{
  "dialect": "sqlite",
  "engine": "sqlite",
  "engine_label": "SQLite 3.x",
  "capabilities": {
    "analyze": false,
    "plan": false,
    "roles": false,
    "schemas": false,
    "writable": true,
    "sqlstate": false,
    "explain_query_plan": true,
    "window_functions": true,
    "recursive_cte": true,
    "filter_clause": true,
    "returning": true,
    "strict_tables": true,
    "right_full_join": true,
    "json1": true,
    "boolean_type": false,
    "date_type": false,
    "interval_type": false,
    "dynamic_typing": true,
    "rowid_tables": true,
    "without_rowid": true,
    "autoincrement": true,
    "like_case_insensitive_ascii": true,
    "ilike": false,
    "date_trunc": false,
    "to_char": false,
    "distinct_on": false,
    "cast_operator": false,
    "interrupt": true
  },
  "capability_notes": {
    "analyze": "SQLite has no EXPLAIN ANALYZE. It has EXPLAIN QUERY PLAN (no actual row counts) and nothing that reports measured per-node time, so M5's plan-reading chapter cannot exist in this dialect.",
    "plan": "The planner's output is a tree of scan and search steps, not a cost model: no estimated rows, no actual rows, no cost. Reporting costs would be invented, so plan:false.",
    "roles": "Authentication is the host's job; SQLite has no roles, no GRANT, and no per-user privileges. Queries that probe pg_roles have no counterpart.",
    "schemas": "There is one namespace and no search_path. Tables are unqualified; the PostgreSQL dataset schema has no SQLite equivalent.",
    "writable": "The file is the database and the engine writes to it. The read-only posture of an anonymous learner is enforced by the host (query_only / a read-only open), not by the engine's permission model.",
    "sqlstate": "SQLite has primary result codes such as SQLITE_CONSTRAINT(19), not five-character SQLSTATE values. Error classification is by message pattern and is tested per code.",
    "explain_query_plan": "EXPLAIN QUERY PLAN returns one row per step as text; it is available and is the dialect's plan affordance, distinct from analyze.",
    "window_functions": "Present since 3.25; the same shapes (PARTITION BY, ORDER BY, frame) parse, with SQLite's own typing and ordering rules.",
    "recursive_cte": "WITH RECURSIVE is present; the M9 lesson shape has a SQLite counterpart.",
    "filter_clause": "Aggregate FILTER (WHERE ...) is present since 3.30.",
    "returning": "RETURNING is present since 3.35, so a writing exercise can see its own rows.",
    "strict_tables": "STRICT tables (3.37) enforce the declared type, but they are opt-in per table; this dataset does not use them, so declared types stay advisory.",
    "right_full_join": "RIGHT and FULL OUTER JOIN are present since 3.39; LEFT JOIN has always been.",
    "json1": "JSON functions are compiled in by default from 3.38; the SQLite dataset does not rely on them.",
    "boolean_type": "There is no BOOLEAN storage class. TRUE/FALSE are keywords for 1/0 (3.23+) and the domain is unenforced, so a boolean column is reported as an integer.",
    "date_type": "There is no DATE or TIMESTAMP storage class. A DATE declaration only picks NUMERIC affinity, and ISO-8601 text is not a numeric literal, so the value is stored as text.",
    "interval_type": "There is no INTERVAL type and no interval arithmetic; a duration is a count plus modifiers passed to date().",
    "dynamic_typing": "A value's type is a property of the value, not the column. The declared type names an affinity applied on write; afterwards a column may hold any of the five classes.",
    "rowid_tables": "Every ordinary table has a hidden rowid unless WITHOUT ROWID is declared; INTEGER PRIMARY KEY is an alias for it.",
    "without_rowid": "WITHOUT ROWID is available for a table keyed by its primary key. This dataset keeps rowid tables so the hidden id is a teaching point.",
    "autoincrement": "AUTOINCREMENT exists but is not the default and only changes INTEGER PRIMARY KEY reuse; this dataset supplies explicit ids, so no AUTOINCREMENT (and no sqlite_sequence table) is used. PostgreSQL's GENERATED ... IDENTITY has no SQLite counterpart.",
    "like_case_insensitive_ascii": "LIKE is case-insensitive for ASCII by default (ILIKE does not exist). The wrong habit — assuming LIKE is case-sensitive — is what the dialect must teach against.",
    "ilike": "No ILIKE. Case-insensitive matching is LIKE, or GLOB/UPPER for a case-sensitive or non-ASCII-precise comparison.",
    "date_trunc": "DATE_TRUNC does not exist. The dialect's date_trunc equivalent is strftime('%Y-%m-01', d) or date(d, 'start of month').",
    "to_char": "TO_CHAR does not exist; formatting is printf()/strftime().",
    "distinct_on": "DISTINCT ON does not exist; the equivalent is a window function or GROUP BY plus an aggregate.",
    "cast_operator": "The :: cast operator does not exist. CAST(x AS type) does, and its rules differ: SQLite's CAST follows SQLite's own affinity rules.",
    "interrupt": "sqlite3_interrupt stops a running statement, and SQLITE_INTERRUPT(9) is a reachable result code, so the host can honour a deadline."
  },
  "types": {
    "note": "A declared type in SQLite names an affinity, not a constraint. The first matching rule below decides the affinity; the order is SQLite's own, from https://sqlite.org/datatype3.html section 3.1.",
    "affinity_rules": [
      {
        "affinity": "INTEGER",
        "when": "the declared type contains \"INT\"",
        "note": "INTEGER, INT and BIGINT all land here. INTEGER PRIMARY KEY is also the rowid alias, which is the only identity mechanism this dataset needs."
      },
      {
        "affinity": "TEXT",
        "when": "the declared type contains \"CHAR\", \"CLOB\" or \"TEXT\"",
        "note": "TEXT, VARCHAR(20) and CHARACTER land here. TEXT affinity never converts a number into text on write, so a number stays a number in a TEXT column."
      },
      {
        "affinity": "BLOB",
        "when": "the declared type contains \"BLOB\", or the column has no declared type",
        "note": "No affinity is applied: any value is stored as given. An untyped column and a BLOB column behave the same way."
      },
      {
        "affinity": "REAL",
        "when": "the declared type contains \"REAL\", \"FLOA\" or \"DOUB\"",
        "note": "REAL, FLOAT and DOUBLE land here. An integral real is written as an integer on disk and read back as a float, so a REAL column always reports a number."
      },
      {
        "affinity": "NUMERIC",
        "when": "anything else (the catch-all)",
        "note": "NUMERIC, DECIMAL(10,2), DATE, TIMESTAMP and BOOLEAN all land here. Numeric-looking text becomes INTEGER or REAL on write; non-numeric text (an ISO-8601 date) stays text. This is why a DATE column holds TEXT."
      }
    ],
    "declared": {
      "INTEGER": "INTEGER",
      "TEXT": "TEXT",
      "NUMERIC": "NUMERIC",
      "DATE": "NUMERIC",
      "TIMESTAMP": "NUMERIC",
      "BOOLEAN": "NUMERIC"
    }
  },
  "value_encoding": {
    "note": "SQLite reports a value's storage class (NULL, INTEGER, REAL, TEXT, BLOB), never the declared type. This is the class -> JSON value map the adapter must use; the declared affinity of the column deliberately does not change it.",
    "integer": {
      "json": "number",
      "rule": "an INTEGER is a JSON number",
      "max_safe_integer": 9007199254740991,
      "big_int": {
        "json": "string",
        "note": "Above 2^53-1 a JSON number cannot hold the value exactly, so it is a decimal string. Same rule web/src/api/pglite.ts already applies to PostgreSQL bigint, so the two dialects agree."
      },
      "note": "SQLite integers are signed 64-bit; only those outside the JSON safe range become strings."
    },
    "real": {
      "json": "number",
      "rule": "a REAL is a JSON number",
      "non_finite": {
        "nan": "null",
        "positive_infinity": "Infinity",
        "negative_infinity": "-Infinity",
        "note": "SQLite stores NaN as NULL, so NaN is reported as null, which is the engine's own answer. Infinity has no JSON literal: reporting null would hide a value and reporting a number would fabricate one, so it is reported as the string \"Infinity\"/\"-Infinity\"."
      },
      "note": "JSON has no non-finite numbers; the named rule above keeps the report honest instead of rounding Inf to something finite."
    },
    "text": {
      "json": "string",
      "rule": "a TEXT value is the string verbatim",
      "note": "No parsing on the way out: a stored date stays the same text, and a numeric-looking string in a TEXT column stays a string (it was not converted on write)."
    },
    "blob": {
      "json": "string",
      "rule": "a BLOB is \\x followed by lowercase hex",
      "prefix": "\\x",
      "encoding": "hex-lowercase",
      "note": "Matches PostgreSQL bytea's text form and the \\x convention in web/src/api/pglite.ts, so both dialects report binary the same way."
    },
    "null": {
      "json": "null",
      "rule": "NULL is JSON null",
      "note": "SQL NULL is not the empty string and not zero; it is reported as null and is never substituted."
    },
    "boolean": {
      "json": "number",
      "rule": "a BOOLEAN-declared column stores 0/1 and is reported as an integer",
      "note": "There is no boolean class. TRUE/FALSE are keywords for 1/0 and the domain is unenforced, so coercion to true/false would be an invention; report the integer."
    },
    "date": {
      "json": "string",
      "rule": "a DATE- or TIMESTAMP-declared column stores ISO-8601 text and is reported verbatim",